{
  "$schema": "https://json-schema.org/draft/2020-12/schema",
  "$id": "https://reviso.work/contracts/adapter-manifest.schema.json",
  "title": "Reviso host adapter manifest",
  "type": "object",
  "additionalProperties": false,
  "required": [
    "contract_version",
    "adapter",
    "authentication",
    "session_identity",
    "surfaces",
    "operations",
    "unsupported",
    "cross_host",
    "install",
    "uninstall"
  ],
  "allOf": [
    {
      "not": {
        "required": ["operations", "unsupported"],
        "properties": {
          "operations": { "contains": { "const": "publish" } },
          "unsupported": { "contains": { "const": "publish" } }
        }
      }
    },
    {
      "not": {
        "required": ["operations", "unsupported"],
        "properties": {
          "operations": { "contains": { "const": "list" } },
          "unsupported": { "contains": { "const": "list" } }
        }
      }
    },
    {
      "not": {
        "required": ["operations", "unsupported"],
        "properties": {
          "operations": { "contains": { "const": "open" } },
          "unsupported": { "contains": { "const": "open" } }
        }
      }
    },
    {
      "not": {
        "required": ["operations", "unsupported"],
        "properties": {
          "operations": { "contains": { "const": "connect" } },
          "unsupported": { "contains": { "const": "connect" } }
        }
      }
    },
    {
      "not": {
        "required": ["operations", "unsupported"],
        "properties": {
          "operations": { "contains": { "const": "status" } },
          "unsupported": { "contains": { "const": "status" } }
        }
      }
    }
  ],
  "properties": {
    "contract_version": {
      "const": "1"
    },
    "adapter": {
      "type": "string",
      "minLength": 1,
      "pattern": "^[a-z0-9][a-z0-9._-]*$"
    },
    "authentication": {
      "type": "array",
      "minItems": 1,
      "uniqueItems": true,
      "items": {
        "enum": [
          "native-host-bridge",
          "local-oauth-store",
          "bearer-config"
        ]
      }
    },
    "session_identity": {
      "enum": [
        "native-session",
        "workspace-context",
        "none"
      ]
    },
    "surfaces": {
      "type": "array",
      "uniqueItems": true,
      "items": {
        "type": "string",
        "minLength": 1
      }
    },
    "operations": {
      "type": "array",
      "minItems": 1,
      "uniqueItems": true,
      "items": {
        "enum": [
          "publish",
          "list",
          "open",
          "connect",
          "status"
        ]
      }
    },
    "unsupported": {
      "type": "array",
      "uniqueItems": true,
      "items": {
        "enum": [
          "publish",
          "list",
          "open",
          "connect",
          "status"
        ]
      }
    },
    "cross_host": {
      "type": "object",
      "additionalProperties": false,
      "required": [
        "write_idempotency",
        "provenance_pair",
        "review_url",
        "error_classes",
        "embed_revoke"
      ],
      "properties": {
        "write_idempotency": {
          "const": "operation_id_reused_on_retry"
        },
        "provenance_pair": {
          "const": [
            "source_kind",
            "source_session_id"
          ]
        },
        "review_url": {
          "const": "canonical_absolute"
        },
        "error_classes": {
          "const": [
            "not_connected",
            "auth_expired",
            "forbidden",
            "not_found",
            "conflict",
            "unavailable",
            "unsupported"
          ]
        },
        "embed_revoke": {
          "const": "required_when_embedded"
        }
      }
    },
    "install": {
      "type": "string",
      "minLength": 1
    },
    "uninstall": {
      "type": "string",
      "minLength": 1
    },
    "update": {
      "type": "string",
      "minLength": 1
    }
  }
}
